<?xml version="1.0" encoding="UTF-8"?>
<!-- edited with XMLSpy v2009 sp1 (http://www.altova.com) by Gerry (Caversham) -->
<modelComponent type="Coupled Ocean-Atmosphere Global Model (needs work)" embedded="false" xmlns="http://www.metaforclimate.eu/cim/1.1" xmlns:xsi="http://www.w3.org/2001/XMLSchema-instance" xsi:schemaLocation="http://www.metaforclimate.eu/cim/1.1 Z:\CIM\XSDs\software.xsd">
	<composition>
		<coupling complete="false" xmlns:xlink="http://www.w3.org/1999/xlink">
			<!-- How easy is it to tell if a coupling is 'complete'? At what stage would this actually be set to 'true'? -->
			<connection type="embedded" xsi:type="Connection">
				<!-- The UM coupling is done 'internally' through a STASH system. Do we need another enumeration for 'type' to describe this, e.g. 'Internal' or is this already catered for?' -->
				<coupling xlink:href="">
					<!-- Should this be here? (probably needs to be removed)-->
				</coupling>
				<lag units="hours">
					<!--UML states 'if present' but declares it's minOccurs as 1. Need to change this as lag/rate may be same as that defined in the parent.-->
					<rate>
						<!-- Is 'rate' the correct term here, i.e. should lag be described using 'timing' convention? -->
						0
					</rate>
				</lag>
				<rate units="hours">
					<!--UML states 'if present' but declares it's minOccurs as 1. Need to change this as lag/rate may be same as that defined in the parent.-->
					<rate>24</rate>
				</rate>
				<source xlink:href="">
					<!-- A link here to the source ComponentProperty/DataSource, in this case 'Surface u windstress' (Atmos)-->
				</source>
				<target xlink:href="">
					<!-- A link here to the target ComponentProperty/DataSource, in this case 'Surface u windstress' (Ocean) -->
				</target>
				<transformer>
					<!-- Want to add 'Conservative Interpolation' here -->
				</transformer>
			</connection>
			<connection type="embedded" xsi:type="Connection">
				<!-- The UM coupling is done 'internally' through a STASH system. Do we need another enumeration for 'type' to describe this, e.g. 'Internal' or is this already catered for?' -->
				<coupling xlink:href="">
					<!-- Should this be here? (probably needs to be removed)-->
				</coupling>
				<lag units="hours">
					<!--UML states 'if present' but declares it's minOccurs as 1. Need to change this as lag/rate may be same as that defined in the parent.-->
					<rate>
						<!-- Is 'rate' the correct term here, i.e. should lag be described using 'timing' convention? -->
						0
					</rate>
				</lag>
				<rate units="hours">
					<!--UML states 'if present' but declares it's minOccurs as 1. Need to change this as lag/rate may be same as that defined in the parent.-->
					<rate>24</rate>
				</rate>
				<source xlink:href="">
					<!-- A link here to the source ComponentProperty/DataSource, in this case 'Surface v windstress' (Atmos)-->
				</source>
				<target xlink:href="">
					<!-- A link here to the target ComponentProperty/DataSource, in this case 'Surface v windstress' (Ocean) -->
				</target>
				<transformer>
					<!-- Want to add 'Conservative Interpolation' here -->
				</transformer>
			</connection>
			<connection type="embedded" xsi:type="Connection">
				<!-- The UM coupling is done 'internally' through a STASH system. Do we need another enumeration for 'type' to describe this, e.g. 'Internal' or is this already catered for?' -->
				<coupling xlink:href="">
					<!-- Should this be here? (probably needs to be removed)-->
				</coupling>
				<lag units="hours">
					<!--UML states 'if present' but declares it's minOccurs as 1. Need to change this as lag/rate may be same as that defined in the parent.-->
					<rate>
						<!-- Is 'rate' the correct term here, i.e. should lag be described using 'timing' convention? -->
						0
					</rate>
				</lag>
				<rate units="hours">
					<!--UML states 'if present' but declares it's minOccurs as 1. Need to change this as lag/rate may be same as that defined in the parent.-->
					<rate>24</rate>
				</rate>
				<source xlink:href="">
					<!-- A link here to the source ComponentProperty/DataSource, in this case 'Wind mixing power' (Atmos)-->
				</source>
				<target xlink:href="">
					<!-- A link here to the target ComponentProperty/DataSource, in this case 'Wind mixing energy flux into ocean near-surface layer' (Ocean) -->
				</target>
				<transformer>
					<!-- Want to add 'Conservative Interpolation' here -->
				</transformer>
			</connection>
			<connection type="embedded" xsi:type="Connection">
				<!-- The UM coupling is done 'internally' through a STASH system. Do we need another enumeration for 'type' to describe this, e.g. 'Internal' or is this already catered for?' -->
				<coupling xlink:href="">
					<!-- Should this be here? (probably needs to be removed)-->
				</coupling>
				<lag units="hours">
					<!--UML states 'if present' but declares it's minOccurs as 1. Need to change this as lag/rate may be same as that defined in the parent.-->
					<rate>
						<!-- Is 'rate' the correct term here, i.e. should lag be described using 'timing' convention? -->
						0
					</rate>
				</lag>
				<rate units="hours">
					<!--UML states 'if present' but declares it's minOccurs as 1. Need to change this as lag/rate may be same as that defined in the parent.-->
					<rate>24</rate>
				</rate>
				<source xlink:href="">
					<!-- A link here to the source ComponentProperty/DataSource, in this case 'Net downward integrated solar radiation' (Atmos)-->
				</source>
				<target xlink:href="">
					<!-- A link here to the target ComponentProperty/DataSource, in this case 'Penetrative solar flux into ocean' (Ocean) -->
				</target>
				<transformer>
					<!-- Want to add 'Conservative Interpolation' here -->
				</transformer>
			</connection>
			<!-- Would like to add extra info here stating that only windstress values defined at ocean points are used to drive ocean -  Should this go in the 'description' of the coupling?' -->
			<description>
				Atmosphere to Ocean Coupling
			</description>
			<lag units="days">
				<rate>
					<!-- (Not sure this should be referred to as 'rate' here) -->
					0 
				</rate>
			</lag>
			<rate units="hours">
				<rate>24</rate>
			</rate>
			<source xlink:href="">
				<!-- Xlink to HiGEM.HiGEM_Atmos -->
			</source>
			<target xlink:href="">
				<!-- Xlink to HiGEM.HiGEM_Ocean -->
			</target>
		</coupling>
		<coupling complete="false" xmlns:xlink="http://www.w3.org/1999/xlink">
			<connection type="embedded" xsi:type="Connection">
				<!-- The UM coupling is done 'internally' through a STASH system. Do we need another enumeration for 'type' to describe this, e.g. 'Internal' or is this already catered for?' -->
				<coupling xlink:href="">
					<!-- Should this be here? (probably needs to be removed)-->
				</coupling>
				<lag units="hours">
					<!--UML states 'if present' but declares it's minOccurs as 1. Need to change this as lag/rate may be same as that defined in the parent.-->
					<rate>
						<!-- Is 'rate' the correct term here, i.e. should lag be described using 'timing' convention? -->
						0
					</rate>
				</lag>
				<rate units="hours">
					<!--UML states 'if present' but declares it's minOccurs as 1. Need to change this as lag/rate may be same as that defined in the parent.-->
					<rate>24</rate>
				</rate>
				<source xlink:href="">
					<!-- A link here to the source ComponentProperty/DataSource, in this case 'Sea surface temperature' (Ocean)-->
				</source>
				<target xlink:href="">
					<!-- A link here to the target ComponentProperty/DataSource, in this case 'Surface temperature' (Atmos) -->
				</target>
				<transformer>
					<!-- Want to add 'Conservative Interpolation' here -->
				</transformer>
			</connection>
			<connection type="embedded" xsi:type="Connection">
				<!-- The UM coupling is done 'internally' through a STASH system. Do we need another enumeration for 'type' to describe this, e.g. 'Internal' or is this already catered for?' -->
				<coupling xlink:href="">
					<!-- Should this be here? (probably needs to be removed)-->
				</coupling>
				<lag units="hours">
					<!--UML states 'if present' but declares it's minOccurs as 1. Need to change this as lag/rate may be same as that defined in the parent.-->
					<rate>
						<!-- Is 'rate' the correct term here, i.e. should lag be described using 'timing' convention? -->
						0
					</rate>
				</lag>
				<rate units="hours">
					<!--UML states 'if present' but declares it's minOccurs as 1. Need to change this as lag/rate may be same as that defined in the parent.-->
					<rate>24</rate>
				</rate>
				<source xlink:href="">
					<!-- A link here to the source ComponentProperty/DataSource, in this case 'Zonal sea currents' (Ocean)-->
				</source>
				<target xlink:href="">
					<!-- A link here to the target ComponentProperty/DataSource, in this case 'Zonal sea currents' (Atmos) -->
				</target>
				<transformer>
					<!-- Want to add 'Conservative Interpolation' here -->
				</transformer>
			</connection>
			<connection type="embedded" xsi:type="Connection">
				<!-- The UM coupling is done 'internally' through a STASH system. Do we need another enumeration for 'type' to describe this, e.g. 'Internal' or is this already catered for?' -->
				<coupling xlink:href="">
					<!-- Should this be here? (probably needs to be removed)-->
				</coupling>
				<lag units="hours">
					<!--UML states 'if present' but declares it's minOccurs as 1. Need to change this as lag/rate may be same as that defined in the parent.-->
					<rate>
						<!-- Is 'rate' the correct term here, i.e. should lag be described using 'timing' convention? -->
						0
					</rate>
				</lag>
				<rate units="hours">